{
  "api_version": "soot/v1",
  "id": "ocr",
  "name": "OCR",
  "description": "Extract native PDF text first; recognize scans with a host-bound DeepSeek OCR model.",
  "skills": [
    {
      "name": "ocr_assess",
      "file": "skills/assess.md",
      "description": "Choose native text or dedicated OCR using evidence from selected pages."
    },
    {
      "name": "ocr_recognize",
      "file": "skills/recognize.md",
      "description": "Use DeepSeek OCR for images, scans or visually incomplete text layers."
    }
  ],
  "tools": [
    {
      "name": "assess",
      "description": "Assess a bounded image/PDF page set without sending it to a model. A text layer is not proof of visual completeness.",
      "parameters": {
        "type": "object",
        "properties": {
          "path": {
            "type": "string",
            "minLength": 1,
            "maxLength": 512,
            "description": "Clean path relative to host FILE_ROOT. Output parents must exist; outputs must be new."
          },
          "pages": {
            "type": "array",
            "items": {
              "type": "integer",
              "minimum": 0,
              "maximum": 4999
            },
            "minItems": 1,
            "maxItems": 8
          }
        },
        "required": [
          "path"
        ],
        "additionalProperties": false
      },
      "run": {
        "program": "tools/run",
        "args": [
          "assess"
        ],
        "stdin": "context",
        "mode": "read",
        "resource": "file_workspace",
        "timeout": "60s",
        "secret_env": {
          "FILE_ROOT": "{{cred:FILE_ROOT}}",
          "PYTHON_EXECUTABLE": "{{cred:PYTHON_EXECUTABLE}}"
        }
      }
    },
    {
      "name": "recognize",
      "description": "Write page-attributed Markdown. Native PDF text is reused unless force=true; scans use host OCR_BINDING OpenAI-compatible DeepSeek OCR endpoint.",
      "parameters": {
        "type": "object",
        "properties": {
          "path": {
            "type": "string",
            "minLength": 1,
            "maxLength": 512,
            "description": "Clean path relative to host FILE_ROOT. Output parents must exist; outputs must be new."
          },
          "pages": {
            "type": "array",
            "items": {
              "type": "integer",
              "minimum": 0,
              "maximum": 4999
            },
            "minItems": 1,
            "maxItems": 8
          },
          "output": {
            "type": "string",
            "minLength": 1,
            "maxLength": 512,
            "description": "Clean path relative to host FILE_ROOT. Output parents must exist; outputs must be new."
          },
          "force": {
            "type": "boolean"
          }
        },
        "required": [
          "path",
          "output"
        ],
        "additionalProperties": false
      },
      "run": {
        "program": "tools/run",
        "args": [
          "recognize"
        ],
        "stdin": "context",
        "mode": "write",
        "resource": "file_workspace",
        "timeout": "25m",
        "secret_env": {
          "FILE_ROOT": "{{cred:FILE_ROOT}}",
          "OCR_BINDING": "{{cred:OCR_BINDING}}",
          "PYTHON_EXECUTABLE": "{{cred:PYTHON_EXECUTABLE}}"
        }
      }
    }
  ],
  "needs": {
    "credentials": {
      "FILE_ROOT": {
        "title": "Thư mục làm việc",
        "description": "Thư mục làm việc của cuộc trò chuyện. Nest cấp tự động; công cụ chỉ đọc và ghi tệp trong thư mục này.",
        "from": "workspace"
      },
      "PYTHON_EXECUTABLE": {
        "title": "Python của máy chủ",
        "description": "Đường dẫn tuyệt đối tới trình Python đã cài sẵn thư viện của pack (xem README). Máy chủ đặt biến môi trường SOOT_MEDIA_PYTHON.",
        "from": "env:SOOT_MEDIA_PYTHON"
      },
      "OCR_BINDING": {
        "title": "Dịch vụ OCR",
        "description": "JSON trỏ tới điểm cuối DeepSeek OCR. Máy chủ đặt biến môi trường SOOT_OCR_BINDING; mẫu trong README.",
        "from": "env:SOOT_OCR_BINDING"
      }
    }
  }
}
