{
  "api_version": "soot/v1",
  "id": "soot-pet",
  "name": "Soot pet",
  "description": "Create a new Soot pet with Codex imagegen: check Codex, prepare jobs, inspect progress and assemble sprites.",
  "skills": [
    {
      "name": "soot-create-pet",
      "description": "Create a new Soot pet or accessory variant using Codex imagegen handoff, seven animated states, sprite assembly and visual review.",
      "file": "skills/create-pet/SKILL.md"
    }
  ],
  "tools": [
    {
      "name": "pet_preflight",
      "description": "Check whether Codex CLI is installed and logged in on the Soot host. Returns user-facing setup steps; does not log in or generate images. Call before starting pet creation.",
      "parameters": {
        "type": "object",
        "properties": {},
        "additionalProperties": false
      },
      "run": {
        "program": "python3",
        "args": [
          "tools/pet.py",
          "preflight"
        ],
        "stdin": "context",
        "mode": "read",
        "resource": "soot_codex_status",
        "timeout": "20s"
      }
    },
    {
      "name": "pet_prepare",
      "description": "Check Codex login, then prepare seven grounded imagegen jobs. Returns blocked onboarding steps without creating files when Codex is unavailable or signed out.",
      "parameters": {
        "type": "object",
        "properties": {
          "id": {
            "type": "string",
            "pattern": "^[a-z][a-z0-9-]{0,47}$",
            "description": "Stable pet job id; a changed brief requires a new id"
          },
          "name": {
            "type": "string",
            "minLength": 1,
            "maxLength": 100
          },
          "accessories": {
            "type": "string",
            "minLength": 1,
            "maxLength": 600,
            "description": "Exact held object and worn accessories; replace the reference prop"
          },
          "action": {
            "type": "string",
            "minLength": 1,
            "maxLength": 400,
            "description": "Restrained hand interaction with the new object"
          },
          "reference": {
            "type": "string",
            "minLength": 1,
            "maxLength": 256,
            "description": "Optional image path relative to host-bound SOOT_PET_STORE; defaults to bundled Soot identity"
          }
        },
        "required": [
          "id",
          "name",
          "accessories",
          "action"
        ],
        "additionalProperties": false
      },
      "run": {
        "program": "python3",
        "args": [
          "tools/pet.py",
          "prepare"
        ],
        "stdin": "context",
        "mode": "write",
        "resource": "soot_pet_store",
        "timeout": "2m",
        "secret_env": {
          "SOOT_PET_STORE": "{{cred:SOOT_PET_STORE}}"
        }
      }
    },
    {
      "name": "pet_inspect",
      "description": "List supplied and missing state sheets for a prepared pet.",
      "parameters": {
        "type": "object",
        "properties": {
          "id": {
            "type": "string",
            "pattern": "^[a-z][a-z0-9-]{0,47}$",
            "description": "Stable pet job id; a changed brief requires a new id"
          }
        },
        "required": [
          "id"
        ],
        "additionalProperties": false
      },
      "run": {
        "program": "python3",
        "args": [
          "tools/pet.py",
          "inspect"
        ],
        "stdin": "context",
        "mode": "read",
        "resource": "soot_pet_store",
        "timeout": "2m",
        "secret_env": {
          "SOOT_PET_STORE": "{{cred:SOOT_PET_STORE}}"
        }
      }
    },
    {
      "name": "pet_assemble",
      "description": "Pack seven generated PNG sheets into a Soot v3 atlas, state sheets and motion previews; visual review remains required.",
      "parameters": {
        "type": "object",
        "properties": {
          "id": {
            "type": "string",
            "pattern": "^[a-z][a-z0-9-]{0,47}$",
            "description": "Stable pet job id; a changed brief requires a new id"
          }
        },
        "required": [
          "id"
        ],
        "additionalProperties": false
      },
      "run": {
        "program": "python3",
        "args": [
          "tools/pet.py",
          "assemble"
        ],
        "stdin": "context",
        "mode": "write",
        "resource": "soot_pet_store",
        "timeout": "2m",
        "secret_env": {
          "SOOT_PET_STORE": "{{cred:SOOT_PET_STORE}}"
        }
      }
    }
  ],
  "needs": {
    "credentials": {
      "SOOT_PET_STORE": {
        "title": "Kho pet",
        "description": "Đường dẫn tuyệt đối tới thư mục lưu tiến độ và ảnh của pet đang tạo. Người vận hành tạo thư mục này trước."
      }
    },
    "env": [
      "PATH",
      "HOME",
      "CODEX_HOME"
    ]
  }
}
